{
  "schemaVersion": "0.1.0",
  "contractType": "capability-registry",
  "capabilityRegistryId": "source-slide-clone-fill-registry",
  "registryVersion": "0.1.0",
  "capabilities": [
    {
      "capabilityId": "source-slide-clone-fill",
      "capabilityVersion": "0.1.0",
      "supportMatrixItemId": "source-slide-clone-fill",
      "executorId": "urn:pptx-pipeline:capability:executor:source-slide-clone-fill:0.1.0",
      "inputSchemaId": "urn:pptx-pipeline:capability:schema:source-slide-clone-fill-input:0.1.0",
      "outputSchemaId": "urn:pptx-pipeline:capability:schema:source-slide-clone-fill-output:0.1.0",
      "qaContractId": "urn:pptx-pipeline:capability:qa:source-slide-clone-fill:0.1.0",
      "requiredBindingRoles": ["body", "title"],
      "conformanceFixtureIds": [
        "source-slide-clone-fill-basic",
        "source-slide-clone-fill-unicode"
      ]
    }
  ]
}
