{
  "schemaVersion": "0.1.0",
  "contractType": "capability-registry",
  "capabilityRegistryId": "native-card-arrow-registry",
  "registryVersion": "0.1.0",
  "capabilities": [
    {
      "capabilityId": "native-card-arrow",
      "capabilityVersion": "0.1.0",
      "supportMatrixItemId": "native-drawingml",
      "executorId": "urn:pptx-pipeline:capability:executor:native-card-arrow:0.1.0",
      "inputSchemaId": "urn:pptx-pipeline:capability:schema:native-card-arrow-input:0.1.0",
      "outputSchemaId": "urn:pptx-pipeline:capability:schema:native-card-arrow-output:0.1.0",
      "qaContractId": "urn:pptx-pipeline:capability:qa:native-card-arrow:0.1.0",
      "requiredBindingRoles": ["anchor"],
      "conformanceFixtureIds": [
        "native-card-arrow-basic",
        "native-card-arrow-escaping"
      ]
    }
  ]
}
