{
  "schemaVersion": "0.1.0",
  "contractType": "capability-registry",
  "capabilityRegistryId": "formula-transplant-registry",
  "registryVersion": "0.1.0",
  "capabilities": [
    {
      "capabilityId": "formula-transplant",
      "capabilityVersion": "0.1.0",
      "supportMatrixItemId": "formula-transplant",
      "executorId": "urn:pptx-compiler:capability:executor:formula-transplant:0.1.0",
      "inputSchemaId": "urn:pptx-compiler:capability:schema:formula-transplant-input:0.1.0",
      "outputSchemaId": "urn:pptx-compiler:capability:schema:formula-transplant-output:0.1.0",
      "qaContractId": "urn:pptx-compiler:capability:qa:formula-transplant:0.1.0",
      "requiredBindingRoles": ["formula-target"],
      "conformanceFixtureIds": ["formula-transplant-fraction"]
    }
  ]
}
